{
  "metadata": {
    "product_family": "Easy TeSys DPE",
    "version": "1.0"
  },
  "hierarchy": [
    {
      "node_id": "SYS-01",
      "parent_id": null,
      "name": "Easy TeSys Motor Starter",
      "level": "System"
    },
    {
      "node_id": "SUB-01",
      "parent_id": "SYS-01",
      "name": "DPE Contactor Assembly",
      "level": "Subsystem"
    },
    {
      "node_id": "SUB-02",
      "parent_id": "SYS-01",
      "name": "DPER Overload Relay",
      "level": "Subsystem"
    },
    {
      "node_id": "SUB-03",
      "parent_id": "SYS-01",
      "name": "DZM Manual Controller",
      "level": "Subsystem"
    }
  ],
  "functions": [
    {
      "function_id": "REQ-01",
      "verb": "conduct",
      "noun": "current",
      "allocations": [
        {
          "node_id": "SUB-01",
          "support_level": "Primary"
        }
      ]
    },
    {
      "function_id": "REQ-02",
      "verb": "actuate",
      "noun": "trip mechanism",
      "allocations": [
        {
          "node_id": "SUB-02",
          "support_level": "Primary"
        }
      ]
    },
    {
      "function_id": "REQ-03",
      "verb": "signal",
      "noun": "trip status",
      "allocations": [
        {
          "node_id": "SUB-02",
          "support_level": "Primary"
        }
      ]
    },
    {
      "function_id": "REQ-04",
      "verb": "interrupt",
      "noun": "electrical circuit",
      "allocations": [
        {
          "node_id": "SUB-03",
          "support_level": "Primary"
        }
      ]
    },
    {
      "function_id": "REQ-05",
      "verb": "provide",
      "noun": "electrical isolation",
      "allocations": [
        {
          "node_id": "SUB-03",
          "support_level": "Primary"
        }
      ]
    },
    {
      "function_id": "REQ-06",
      "verb": "signal",
      "noun": "contact status",
      "allocations": [
        {
          "node_id": "SUB-01",
          "support_level": "Primary"
        }
      ]
    },
    {
      "function_id": "REQ-08",
      "verb": "maintain",
      "noun": "mechanical durability",
      "allocations": [
        {
          "node_id": "SUB-01",
          "support_level": "Primary"
        },
        {
          "node_id": "SUB-02",
          "support_level": "Primary"
        },
        {
          "node_id": "SUB-03",
          "support_level": "Primary"
        }
      ]
    },
    {
      "function_id": "REQ-09",
      "verb": "withstand",
      "noun": "vibrations",
      "allocations": [
        {
          "node_id": "SUB-01",
          "support_level": "Primary"
        },
        {
          "node_id": "SUB-02",
          "support_level": "Primary"
        },
        {
          "node_id": "SUB-03",
          "support_level": "Primary"
        }
      ]
    }
  ],
  "failure_modes": [
    {
      "failure_id": "FAIL-REQ-01-TLF-01",
      "function_id": "REQ-01",
      "category": "Total Loss of Function",
      "syntactical_description": "Fails to conduct current",
      "defect_code": "DC-9305a499",
      "end_effect": "Loss of motor drive",
      "severity": 7
    },
    {
      "failure_id": "FAIL-REQ-01-PDF-02",
      "function_id": "REQ-01",
      "category": "Partial / Degraded Function",
      "syntactical_description": "Provides insufficient conduct current",
      "defect_code": "DC-6d6bde2e",
      "end_effect": "Loss of motor drive",
      "severity": 7
    },
    {
      "failure_id": "FAIL-REQ-01-PDF-03",
      "function_id": "REQ-01",
      "category": "Partial / Degraded Function",
      "syntactical_description": "Provides excessive conduct current",
      "defect_code": "DC-457cc695",
      "end_effect": "Loss of motor drive",
      "severity": 7
    },
    {
      "failure_id": "FAIL-REQ-01-ITF-04",
      "function_id": "REQ-01",
      "category": "Intermittent Function",
      "syntactical_description": "Intermittently conduct current",
      "defect_code": "DC-4dc9853b",
      "end_effect": "Loss of motor drive",
      "severity": 7
    },
    {
      "failure_id": "FAIL-REQ-01-PDF-05",
      "function_id": "REQ-01",
      "category": "Partial / Degraded Function",
      "syntactical_description": "conduct current below threshold",
      "defect_code": "DC-71376f8c",
      "end_effect": "Loss of motor drive",
      "severity": 7
    },
    {
      "failure_id": "FAIL-REQ-01-USF-06",
      "function_id": "REQ-01",
      "category": "Unintended / Spurious Function",
      "syntactical_description": "Uncommanded conduct current",
      "defect_code": "DC-4564b61f",
      "end_effect": "Loss of motor drive",
      "severity": 7
    },
    {
      "failure_id": "FAIL-REQ-01-DEF-07",
      "function_id": "REQ-01",
      "category": "Delayed / Early Function",
      "syntactical_description": "conduct current too late",
      "defect_code": "DC-c6eecf01",
      "end_effect": "Loss of motor drive",
      "severity": 7
    },
    {
      "failure_id": "FAIL-REQ-02-TLF-01",
      "function_id": "REQ-02",
      "category": "Total Loss of Function",
      "syntactical_description": "Fails to actuate trip mechanism",
      "defect_code": "DC-d6026075",
      "end_effect": "Fire or thermal damage",
      "severity": 9
    },
    {
      "failure_id": "FAIL-REQ-02-PDF-02",
      "function_id": "REQ-02",
      "category": "Partial / Degraded Function",
      "syntactical_description": "Provides insufficient actuate trip mechanism",
      "defect_code": "DC-f598e39a",
      "end_effect": "Fire or thermal damage",
      "severity": 9
    },
    {
      "failure_id": "FAIL-REQ-02-PDF-03",
      "function_id": "REQ-02",
      "category": "Partial / Degraded Function",
      "syntactical_description": "Provides excessive actuate trip mechanism",
      "defect_code": "DC-3d974fa0",
      "end_effect": "Fire or thermal damage",
      "severity": 9
    },
    {
      "failure_id": "FAIL-REQ-02-ITF-04",
      "function_id": "REQ-02",
      "category": "Intermittent Function",
      "syntactical_description": "Intermittently actuate trip mechanism",
      "defect_code": "DC-fc798b29",
      "end_effect": "Fire or thermal damage",
      "severity": 9
    },
    {
      "failure_id": "FAIL-REQ-02-PDF-05",
      "function_id": "REQ-02",
      "category": "Partial / Degraded Function",
      "syntactical_description": "actuate trip mechanism below threshold",
      "defect_code": "DC-a13aacaa",
      "end_effect": "Fire or thermal damage",
      "severity": 9
    },
    {
      "failure_id": "FAIL-REQ-02-USF-06",
      "function_id": "REQ-02",
      "category": "Unintended / Spurious Function",
      "syntactical_description": "Uncommanded actuate trip mechanism",
      "defect_code": "DC-41ecf356",
      "end_effect": "Fire or thermal damage",
      "severity": 9
    },
    {
      "failure_id": "FAIL-REQ-02-DEF-07",
      "function_id": "REQ-02",
      "category": "Delayed / Early Function",
      "syntactical_description": "actuate trip mechanism too late",
      "defect_code": "DC-d3aa25ec",
      "end_effect": "Fire or thermal damage",
      "severity": 9
    },
    {
      "failure_id": "FAIL-REQ-03-TLF-01",
      "function_id": "REQ-03",
      "category": "Total Loss of Function",
      "syntactical_description": "Fails to signal trip status",
      "defect_code": "DC-a94e030c",
      "end_effect": "Loss of status monitoring",
      "severity": 4
    },
    {
      "failure_id": "FAIL-REQ-03-PDF-02",
      "function_id": "REQ-03",
      "category": "Partial / Degraded Function",
      "syntactical_description": "Provides insufficient signal trip status",
      "defect_code": "DC-30c37a32",
      "end_effect": "Loss of status monitoring",
      "severity": 4
    },
    {
      "failure_id": "FAIL-REQ-03-PDF-03",
      "function_id": "REQ-03",
      "category": "Partial / Degraded Function",
      "syntactical_description": "Provides excessive signal trip status",
      "defect_code": "DC-b5565f16",
      "end_effect": "Loss of status monitoring",
      "severity": 4
    },
    {
      "failure_id": "FAIL-REQ-03-ITF-04",
      "function_id": "REQ-03",
      "category": "Intermittent Function",
      "syntactical_description": "Intermittently signal trip status",
      "defect_code": "DC-fb9a117c",
      "end_effect": "Loss of status monitoring",
      "severity": 4
    },
    {
      "failure_id": "FAIL-REQ-03-PDF-05",
      "function_id": "REQ-03",
      "category": "Partial / Degraded Function",
      "syntactical_description": "signal trip status below threshold",
      "defect_code": "DC-501cb022",
      "end_effect": "Loss of status monitoring",
      "severity": 4
    },
    {
      "failure_id": "FAIL-REQ-03-USF-06",
      "function_id": "REQ-03",
      "category": "Unintended / Spurious Function",
      "syntactical_description": "Uncommanded signal trip status",
      "defect_code": "DC-36ec6bad",
      "end_effect": "Loss of status monitoring",
      "severity": 4
    },
    {
      "failure_id": "FAIL-REQ-03-DEF-07",
      "function_id": "REQ-03",
      "category": "Delayed / Early Function",
      "syntactical_description": "signal trip status too late",
      "defect_code": "DC-b7117c7f",
      "end_effect": "Loss of status monitoring",
      "severity": 4
    },
    {
      "failure_id": "FAIL-REQ-04-TLF-01",
      "function_id": "REQ-04",
      "category": "Total Loss of Function",
      "syntactical_description": "Fails to interrupt electrical circuit",
      "defect_code": "DC-6453dea7",
      "end_effect": "Upstream protection trip / Arc Flash",
      "severity": 10
    },
    {
      "failure_id": "FAIL-REQ-04-PDF-02",
      "function_id": "REQ-04",
      "category": "Partial / Degraded Function",
      "syntactical_description": "Provides insufficient interrupt electrical circuit",
      "defect_code": "DC-b1be394a",
      "end_effect": "Upstream protection trip / Arc Flash",
      "severity": 10
    },
    {
      "failure_id": "FAIL-REQ-04-PDF-03",
      "function_id": "REQ-04",